{"$schema":"https://json-schema.org/draft/2020-12/schema","type":"object","required":["schema_version","phase","native_scan","security_review","external_scan","external_profile","test_health","registry_records"],"properties":{"schema_version":{"const":"1.0"},"phase":{"const":"SECURITY_RELIABILITY_P8_ASSURANCE_PROFILE"},"native_scan":{"type":"string"},"security_review":{"type":"string"},"external_scan":{"type":"string"},"external_profile":{"type":"string"},"test_health":{"type":"string"},"registry_records":{"type":"array","items":{"type":"string"}}},"additionalProperties":false}
