{"schema_version":"1.0","phase":"SECURITY_RELIABILITY_P8_ASSURANCE_PROFILE","native_scan":".aledevos/state/security-reliability/native-scan.json","security_review":".aledevos/state/security-reliability/security-review.json","external_scan":".aledevos/state/security-reliability/external-scan.json","external_profile":".aledevos/state/security-reliability/external-profile.json","test_health":".aledevos/state/security-reliability/test-health.json","registry_records":[]}
